{
  "schema": "amf.conversation-archive-conformance/v1",
  "orderingVersion": "conversation-archive-order/v1",
  "adapterLabels": ["postgresql", "sqlite"],
  "scenarios": [
    { "id": "commit", "request": { "operation": "append", "idempotencyKey": "cai_commit0001", "event": { "eventId": "cevt_archive0001", "conversationId": "ccon_archive0001", "logicalDigest": "sha256:1111111111111111111111111111111111111111111111111111111111111111", "payloadDigest": "sha256:aaaaaaaaaaaaaaaaaaaaaaaaaaaaaaaaaaaaaaaaaaaaaaaaaaaaaaaaaaaaaaaa", "sourceOccurredAt": "2026-01-02T03:04:05Z", "sourceSequence": 7, "state": "active" } }, "expected": { "result": { "outcome": "stored", "stateChanged": true, "items": [], "nextCursor": null }, "audit": { "action": "append", "outcome": "recorded", "required": true } } },
    { "id": "rollback", "request": { "operation": "append", "idempotencyKey": "cai_rollback01", "event": { "eventId": "cevt_archive0002", "conversationId": "ccon_archive0001", "logicalDigest": "sha256:2222222222222222222222222222222222222222222222222222222222222222", "payloadDigest": "sha256:bbbbbbbbbbbbbbbbbbbbbbbbbbbbbbbbbbbbbbbbbbbbbbbbbbbbbbbbbbbbbbbb", "sourceOccurredAt": "2026-01-02T03:04:06Z", "sourceSequence": 8, "state": "active" } }, "expected": { "result": { "outcome": "transaction_rolled_back", "stateChanged": false, "items": [], "nextCursor": null }, "audit": { "action": "append", "outcome": "absent", "required": true } } },
    { "id": "replay", "request": { "operation": "append", "idempotencyKey": "cai_commit0001", "event": { "eventId": "cevt_archive0001", "conversationId": "ccon_archive0001", "logicalDigest": "sha256:1111111111111111111111111111111111111111111111111111111111111111", "payloadDigest": "sha256:aaaaaaaaaaaaaaaaaaaaaaaaaaaaaaaaaaaaaaaaaaaaaaaaaaaaaaaaaaaaaaaa", "sourceOccurredAt": "2026-01-02T03:04:05Z", "sourceSequence": 7, "state": "active" } }, "expected": { "result": { "outcome": "duplicate", "stateChanged": false, "items": [], "nextCursor": null }, "audit": { "action": "append", "outcome": "recorded", "required": true } } },
    { "id": "changed_payload_conflict", "request": { "operation": "append", "idempotencyKey": "cai_commit0001", "event": { "eventId": "cevt_archive0001", "conversationId": "ccon_archive0001", "logicalDigest": "sha256:1111111111111111111111111111111111111111111111111111111111111111", "payloadDigest": "sha256:cccccccccccccccccccccccccccccccccccccccccccccccccccccccccccccccc", "sourceOccurredAt": "2026-01-02T03:04:05Z", "sourceSequence": 7, "state": "active" } }, "expected": { "result": { "outcome": "conflict_visible", "stateChanged": false, "items": [], "nextCursor": null, "conflict": { "eventId": "cevt_archive0001", "logicalDigest": "sha256:1111111111111111111111111111111111111111111111111111111111111111", "existingPayloadDigest": "sha256:aaaaaaaaaaaaaaaaaaaaaaaaaaaaaaaaaaaaaaaaaaaaaaaaaaaaaaaaaaaaaaaa", "receivedPayloadDigest": "sha256:cccccccccccccccccccccccccccccccccccccccccccccccccccccccccccccccc" } }, "audit": { "action": "append", "outcome": "recorded", "required": true } } },
    { "id": "ordering", "request": { "operation": "list", "conversationId": "ccon_archive0001", "limit": 3, "includeTombstones": false }, "expected": { "result": { "outcome": "listed", "stateChanged": false, "items": [{ "eventId": "cevt_archive0003", "conversationId": "ccon_archive0001", "logicalDigest": "sha256:3333333333333333333333333333333333333333333333333333333333333333", "payloadDigest": "sha256:dddddddddddddddddddddddddddddddddddddddddddddddddddddddddddddddd", "sourceOccurredAt": "2026-01-02T03:04:04Z", "sourceSequence": 9, "state": "active" }, { "eventId": "cevt_archive0001", "conversationId": "ccon_archive0001", "logicalDigest": "sha256:1111111111111111111111111111111111111111111111111111111111111111", "payloadDigest": "sha256:aaaaaaaaaaaaaaaaaaaaaaaaaaaaaaaaaaaaaaaaaaaaaaaaaaaaaaaaaaaaaaaa", "sourceOccurredAt": "2026-01-02T03:04:05Z", "sourceSequence": 7, "state": "active" }, { "eventId": "cevt_archive0004", "conversationId": "ccon_archive0001", "logicalDigest": "sha256:4444444444444444444444444444444444444444444444444444444444444444", "payloadDigest": "sha256:eeeeeeeeeeeeeeeeeeeeeeeeeeeeeeeeeeeeeeeeeeeeeeeeeeeeeeeeeeeeeeee", "sourceOccurredAt": "2026-01-02T03:04:05Z", "sourceSequence": 7, "state": "active" }], "nextCursor": null }, "audit": { "action": "list", "outcome": "recorded", "required": false } } },
    { "id": "pagination_cursor_binding", "request": { "operation": "list", "conversationId": "ccon_archive0001", "limit": 1, "includeTombstones": false, "cursor": "car_cursorbinding000001" }, "cursorBinding": { "conversationId": "ccon_archive0002", "includeTombstones": false, "orderingVersion": "conversation-archive-order/v1", "limit": 1 }, "expected": { "result": { "outcome": "cursor_binding_invalid", "stateChanged": false, "items": [], "nextCursor": null }, "audit": { "action": "list", "outcome": "recorded", "required": false } } },
    { "id": "tombstone_visibility", "request": { "operation": "list", "conversationId": "ccon_archive0001", "limit": 1, "includeTombstones": true }, "tombstoneVisibility": { "ordinaryItems": [], "includedTombstone": { "eventId": "cevt_tombstone0001", "conversationId": "ccon_archive0001", "logicalDigest": "sha256:5555555555555555555555555555555555555555555555555555555555555555", "payloadDigest": "sha256:ffffffffffffffffffffffffffffffffffffffffffffffffffffffffffffffff", "sourceOccurredAt": "2026-01-02T03:05:00Z", "sourceSequence": 10, "state": "tombstone" } }, "expected": { "result": { "outcome": "listed", "stateChanged": false, "items": [{ "eventId": "cevt_tombstone0001", "conversationId": "ccon_archive0001", "logicalDigest": "sha256:5555555555555555555555555555555555555555555555555555555555555555", "payloadDigest": "sha256:ffffffffffffffffffffffffffffffffffffffffffffffffffffffffffffffff", "sourceOccurredAt": "2026-01-02T03:05:00Z", "sourceSequence": 10, "state": "tombstone" }], "nextCursor": null }, "audit": { "action": "list", "outcome": "recorded", "required": false } } },
    { "id": "retention_boundary", "request": { "operation": "apply_retention", "idempotencyKey": "cai_retention1", "cutoff": "2026-01-02T03:06:00Z", "limit": 100 }, "retentionBoundary": { "cutoff": "2026-01-02T03:06:00Z", "expiredAtCutoff": { "event": { "eventId": "cevt_archive0005", "conversationId": "ccon_archive0001", "logicalDigest": "sha256:6666666666666666666666666666666666666666666666666666666666666666", "payloadDigest": "sha256:9999999999999999999999999999999999999999999999999999999999999999", "sourceOccurredAt": "2026-01-02T03:06:30Z", "sourceSequence": 11, "state": "tombstone" }, "expiresAt": "2026-01-02T03:06:00Z" }, "retainedAfterCutoff": { "event": { "eventId": "cevt_archive0007", "conversationId": "ccon_archive0001", "logicalDigest": "sha256:7777777777777777777777777777777777777777777777777777777777777777", "payloadDigest": "sha256:1212121212121212121212121212121212121212121212121212121212121212", "sourceOccurredAt": "2026-01-02T03:05:00Z", "sourceSequence": 12, "state": "active" }, "expiresAt": "2026-01-02T03:06:01Z" } }, "expected": { "result": { "outcome": "retention_expired", "stateChanged": true, "items": [], "nextCursor": null }, "audit": { "action": "apply_retention", "outcome": "recorded", "required": true } } },
    { "id": "audit_outage", "request": { "operation": "append", "idempotencyKey": "cai_auditoutage", "event": { "eventId": "cevt_archive0006", "conversationId": "ccon_archive0001", "logicalDigest": "sha256:8888888888888888888888888888888888888888888888888888888888888888", "payloadDigest": "sha256:1313131313131313131313131313131313131313131313131313131313131313", "sourceOccurredAt": "2026-01-02T03:07:00Z", "sourceSequence": 12, "state": "active" } }, "expected": { "result": { "outcome": "audit_unavailable", "stateChanged": false, "items": [], "nextCursor": null }, "audit": { "action": "append", "outcome": "unavailable", "required": true } } }
  ]
}
